rowNum,listing_title,listing_distance_miles,listing_url,price,listingPriceRedu,Body Style,Drive Type,Engine,Mileage,Transmission,ATC Car ID,Fuel,Stock #,VIN,carFeaturesText,exterior,interior,sellerComment,Basic Warranty,Corrosion Warranty,Drivetrain Warranty,Roadside Assistance Warranty,newListingIndicator,Dealer,model,year,ownershipStatus,Location,sellerType,CityMpg,HyMpg
1,Used 2015 Jeep Wrangler Willys Wheeler,12,/cars-for-sale/vehicledetails.xhtml?listingId=478483503&zip=84604&referrer=%2Fcars-for-sale%2Fsearchresults.xhtml%3Fzip%3D84604%26sellerTypes%3Dp%26minPrice%3D10000%26startYear%3D1981%26numRecords%3D100%26sortBy%3Drelevance%26maxPrice%3D27000%26incremental%3Dall%26firstRecord%3D0%26endYear%3D2019%26makeCodeList%3DJEEP%26searchRadius%3D0&sellerTypes=p&minPrice=10000&startYear=1981&numRecords=100&maxPrice=27000&firstRecord=0&endYear=2019&makeCodeList=JEEP&searchRadius=0&makeCode1=JEEP&modelCode1=WRANGLER,21999,FALSE,Sport Utility,4 wheel drive - rear,6-Cylinder,58e3,Automatic,AT-1C85142F,Gasoline,Information Unavailable,Information Unavailable,Bluetooth Hands-FreeCD PlayerCruise ControlKeyless EntryLift KitPower LocksPower WindowsPremium WheelsSteering Wheel ControlsTrailer Hitch,#05518D,#000000,$3500 in upgrades:5-New 35x12.5 Toyo open country MT tiresTerra flex lift with (4) Fox shocks Terra flex spare tire carrier and hilift jack mount Tow hitchBimini soft top included Tonneau cover included All scheduled maintenance. All records. Excellent condition. Looks & drives great. Mostly highway miles. New tires. Non-smoker. One owner. Still under factory warranty. Very clean interior. Well maintained.,NA,NA,NA,NA,FALSE,Private Seller,Willys Wheeler,2015,Used,Provo,Private,NA,NA
2,Used 2008 Jeep Wrangler Rubicon,15,/cars-for-sale/vehicledetails.xhtml?listingId=483480682&zip=84604&referrer=%2Fcars-for-sale%2Fsearchresults.xhtml%3Fzip%3D84604%26sellerTypes%3Dp%26minPrice%3D10000%26startYear%3D1981%26numRecords%3D100%26sortBy%3Drelevance%26maxPrice%3D27000%26incremental%3Dall%26firstRecord%3D0%26endYear%3D2019%26makeCodeList%3DJEEP%26searchRadius%3D0&sellerTypes=p&minPrice=10000&startYear=1981&numRecords=100&maxPrice=27000&firstRecord=0&endYear=2019&makeCodeList=JEEP&searchRadius=0&makeCode1=JEEP&modelCode1=WRANGLER,15900,FALSE,Sport Utility,4 wheel drive,6-Cylinder,121e3,Automatic,AT-1CD1546A,Gasoline,Information Unavailable,1J4GA64158L571618,Keyless EntryPower LocksPower WindowsPremium AudioPremium WheelsTrailer Hitch,#F3D511,#000000,"This Jeep Rubicon is in pristine condition with no dents or scratches and upholstery that looks brand new.  Black tint factory windows in back,  air conditioning, great stereo, tow hitch and  Jeep mud mats. It has been babied by me and always garaged. It has been my fishing car which hasn?t seen a lot of action the past few years. I have maintained in addition to oil changes, replacing the sway bar last year and new brakes.  Always garaged, . Excellent condition, Looks & drives great. No accidents, Non-smoker.    We are building in St George and I need a commuter car to pack on the miles.  Will need new tires soon.",NA,NA,NA,NA,FALSE,Private Seller,Rubicon,2008,Used,Provo,Private,NA,NA
3,Used 2014 Jeep Grand Cherokee Limited,180,/cars-for-sale/vehicledetails.xhtml?listingId=476210260&zip=84604&referrer=%2Fcars-for-sale%2Fsearchresults.xhtml%3Fzip%3D84604%26sellerTypes%3Dp%26minPrice%3D10000%26startYear%3D1981%26numRecords%3D100%26sortBy%3Drelevance%26maxPrice%3D27000%26incremental%3Dall%26firstRecord%3D0%26endYear%3D2019%26makeCodeList%3DJEEP%26searchRadius%3D0&sellerTypes=p&minPrice=10000&startYear=1981&numRecords=100&maxPrice=27000&firstRecord=0&endYear=2019&makeCodeList=JEEP&searchRadius=0&makeCode1=JEEP&modelCode1=JEEPGRAND,24999,FALSE,Sport Utility,4 wheel drive,6-Cylinder,98400,Automatic,AT-1C626454,Diesel,Information Unavailable,1C4RJFBM9EC528469,Backup CameraBluetooth Hands-FreeCruise ControlHeated SeatsKeyless EntryLeather SeatsMulti-zone Climate ControlNavigationPortable Audio ConnectionPower Locks,#454545,#F5F5DC,"Very clean, limited edition. Runs and drives excellent. Turbocharged diesel which gets 32 highway MPG. 4x4. New tires and windshield .Original one owner SUV., Always garaged, Factory GPS system, Non-smoker, Satellite radio, rear backup camera and park assist. Still under factory warranty, Very clean interior. Listed new for over $40,000. Would consider Older Suburban or Yukon XL in trade plus cash.",NA,NA,NA,NA,FALSE,Private Seller,Limited,2014,Used,Provo,Private,NA,NA
4,Used 2014 Jeep Grand Cherokee Overland,238,/cars-for-sale/vehicledetails.xhtml?listingId=470967091&zip=84604&referrer=%2Fcars-for-sale%2Fsearchresults.xhtml%3Fzip%3D84604%26sellerTypes%3Dp%26minPrice%3D10000%26startYear%3D1981%26numRecords%3D100%26sortBy%3Drelevance%26maxPrice%3D27000%26incremental%3Dall%26firstRecord%3D0%26endYear%3D2019%26makeCodeList%3DJEEP%26searchRadius%3D0&sellerTypes=p&minPrice=10000&startYear=1981&numRecords=100&maxPrice=27000&firstRecord=0&endYear=2019&makeCodeList=JEEP&searchRadius=0&makeCode1=JEEP&modelCode1=JEEPGRAND,21e3,FALSE,Sport Utility,Information Unavailable,8-Cylinder,100400,Automatic,AT-1C126333,Gasoline,Information Unavailable,1C4RJFCT6EC190695,Backup CameraBluetooth Hands-FreeCruise ControlHeated SeatsKeyless EntryLeather SeatsMulti-zone Climate ControlNavigationPortable Audio ConnectionPower Locks,#D7D7D7,#D2B48C,"A/C ice cold, All scheduled maintenance, Always garaged, Custom wheels, Excellent condition, Factory GPS system, Fully loaded with all the goodies, Looks & drives great, Mostly highway miles, Must see, New tires, No accidents, Non-smoker, Satellite radio, Seats like new, Title in hand, Upgraded sound system, Very clean interior, Well maintained",NA,NA,NA,NA,FALSE,Private Seller,Overland,2014,Used,Provo,Private,NA,NA
5,Used 2007 Jeep Wrangler Unlimited,346,/cars-for-sale/vehicledetails.xhtml?listingId=463761177&zip=84604&referrer=%2Fcars-for-sale%2Fsearchresults.xhtml%3Fzip%3D84604%26sellerTypes%3Dp%26minPrice%3D10000%26startYear%3D1981%26numRecords%3D100%26sortBy%3Drelevance%26maxPrice%3D27000%26incremental%3Dall%26firstRecord%3D0%26endYear%3D2019%26makeCodeList%3DJEEP%26searchRadius%3D0&sellerTypes=p&minPrice=10000&startYear=1981&numRecords=100&maxPrice=27000&firstRecord=0&endYear=2019&makeCodeList=JEEP&searchRadius=0&makeCode1=JEEP&modelCode1=WRANGLER,17e3,FALSE,Sport Utility,2 wheel drive - rear,6 Cylinder,93e3,Automatic,AT-1BA46F19,Gasoline,Information Unavailable,1J4GB39147L226129,Power LocksPower WindowsPremium Audio,#D7D7D7,#000000,"Great condition!Brand new tires(less than 500 miles), new rims, and lifted. Great Jeep in perfect condition Text me with questions801-234-9730In Las Vegas",NA,NA,NA,NA,FALSE,Private Seller,Unlimited,2007,Used,Provo,Private,NA,NA
6,Used 2011 Jeep Wrangler Unlimited Sport,350,/cars-for-sale/vehicledetails.xhtml?listingId=475839627&zip=84604&referrer=%2Fcars-for-sale%2Fsearchresults.xhtml%3Fzip%3D84604%26sellerTypes%3Dp%26minPrice%3D10000%26startYear%3D1981%26numRecords%3D100%26sortBy%3Drelevance%26maxPrice%3D27000%26incremental%3Dall%26firstRecord%3D0%26endYear%3D2019%26makeCodeList%3DJEEP%26searchRadius%3D0&sellerTypes=p&minPrice=10000&startYear=1981&numRecords=100&maxPrice=27000&firstRecord=0&endYear=2019&makeCodeList=JEEP&searchRadius=0&makeCode1=JEEP&modelCode1=WRANGLER,24900,FALSE,Sport Utility,4 wheel drive - rear,6-Cylinder,102e3,Manual,AT-1C5CBC8B,Gasoline,Information Unavailable,1J4BA3H1XBL541623,CD PlayerCruise ControlKeyless EntryLift KitPortable Audio ConnectionPower LocksPower WindowsPremium WheelsSecurity SystemSteering Wheel Controls,#E31313,#000000,"Fully loaded with all the goodies, Super Sharp Jeep Wrangler Unlimited, Custom black steel wheels with 315 70R Procomp Tires, 2 1/2 inch lift, brand new Rancho Shocks, Smitty Built Winch, Rock Sliders, Heavy Duty Rear Bumper and Tire Rack, Brand New Hard Top, Comes with Bikini Top and Soft Top Too! Ice Cold AC, Looks & drives great, No accidents, Non-smoker, Title in hand, Upgraded Pioneer sound system with brand new Cerwin Vega Speakers, Very clean interior, Heavy Duty Floor Mats, Well maintained. Outstanding Jeep with awesome stance and build. Everything is already done.",NA,NA,NA,NA,FALSE,Private Seller,Unlimited Sport,2011,Used,Provo,Private,NA,NA
7,Used 2014 Jeep Patriot Altitude,350,/cars-for-sale/vehicledetails.xhtml?listingId=466076234&zip=84604&referrer=%2Fcars-for-sale%2Fsearchresults.xhtml%3Fzip%3D84604%26sellerTypes%3Dp%26minPrice%3D10000%26startYear%3D1981%26numRecords%3D100%26sortBy%3Drelevance%26maxPrice%3D27000%26incremental%3Dall%26firstRecord%3D0%26endYear%3D2019%26makeCodeList%3DJEEP%26searchRadius%3D0&sellerTypes=p&minPrice=10000&startYear=1981&numRecords=100&maxPrice=27000&firstRecord=0&endYear=2019&makeCodeList=JEEP&searchRadius=0&makeCode1=JEEP&modelCode1=PATRIOT,16e3,FALSE,Sport Utility,2 wheel drive - front,4 Cylinder,32280,Automatic,AT-1BC7C24A,Gasoline,Information Unavailable,1C4NJPBA5ED850790,CD PlayerPortable Audio ConnectionPremium WheelsTrailer Hitch,#8B8B8B,#000000,Super low miles! Great car I'm just downsizing. Still under manufacture warranty.  A/C ice cold. All scheduled maintenance. Custom wheels. Looks & drives great. Must see. No accidents. Non-smoker. One owner. Still under factory warranty. Very clean interior. Well maintained. Hitch mounted.,NA,NA,NA,NA,FALSE,Private Seller,Altitude,2014,Used,Provo,Private,NA,NA
8,Used 2008 Jeep Wrangler Sahara,352,/cars-for-sale/vehicledetails.xhtml?listingId=474337137&zip=84604&referrer=%2Fcars-for-sale%2Fsearchresults.xhtml%3Fzip%3D84604%26sellerTypes%3Dp%26minPrice%3D10000%26startYear%3D1981%26numRecords%3D100%26sortBy%3Drelevance%26maxPrice%3D27000%26incremental%3Dall%26firstRecord%3D0%26endYear%3D2019%26makeCodeList%3DJEEP%26searchRadius%3D0&sellerTypes=p&minPrice=10000&startYear=1981&numRecords=100&maxPrice=27000&firstRecord=0&endYear=2019&makeCodeList=JEEP&searchRadius=0&makeCode1=JEEP&modelCode1=WRANGLER,14850,FALSE,Sport Utility,4 wheel drive,6-Cylinder,129693,Automatic,AT-1C45CF71,Gasoline,Information Unavailable,1J8FA54118L565870,CD PlayerCruise ControlKeyless EntryNavigationPower LocksPower WindowsPremium AudioPremium WheelsSecurity SystemSteering Wheel Controls,#248B15,#454545,"VERY CLEAN -- Not Off Roaded  - Factory Dashboard GPS - Hard Top/Soft Top - Satellite Radio - Traction Control - Remote Entry - Air Conditioning - Factory Fog Lights - Cruise ControlMostly Highway Miles - One Owner - Title In Hand - VEHICLE HISTORY REPORT AVAILABLE AND PROVIDED UPON REQUEST , No accidents, One owner",NA,NA,NA,NA,FALSE,Private Seller,Sahara,2008,Used,Provo,Private,NA,NA
9,Used 2002 Jeep Wrangler Sahara,353,/cars-for-sale/vehicledetails.xhtml?listingId=443134615&zip=84604&referrer=%2Fcars-for-sale%2Fsearchresults.xhtml%3Fzip%3D84604%26sellerTypes%3Dp%26minPrice%3D10000%26startYear%3D1981%26numRecords%3D100%26sortBy%3Drelevance%26maxPrice%3D27000%26incremental%3Dall%26firstRecord%3D0%26endYear%3D2019%26makeCodeList%3DJEEP%26searchRadius%3D0&sellerTypes=p&minPrice=10000&startYear=1981&numRecords=100&maxPrice=27000&firstRecord=0&endYear=2019&makeCodeList=JEEP&searchRadius=0&makeCode1=JEEP&modelCode1=WRANGLER,11500,FALSE,Sport Utility,4 wheel drive,6-Cylinder,2100,Manual,AT-1A69B297,Gasoline,Information Unavailable,1J4FA59S72P722059,CD PlayerCruise ControlLift KitPremium AudioSteering Wheel ControlsTrailer Hitch,#D7D7D7,#D2B48C,"I am selling my 2002 Jeep Wrangler Sahara, I'm the second owner purchased from Medved Castle Rock on 7-17-2004 with 22,634 miles, it now has 1,600 miles on the new motor with the remainder of a 3yr 100,000 mile warranty and 142,300 original miles, Unlike other Jeeps you will see this one runs great and has BEEN PRO-ACTIVELY MAINTAINED and always garaged. Just inspected by Hotchkiss Auto Repair on 10-26-16, most recent maintenance items have been performed at Hotchkiss Auto repair, Hi-lo gear selection, Automatic locking hubs, Transmission: 5-speed manual, Slotted front disc / rear drum brakes, Engine immobilizer, Front fog/driving lights, Cruise control, Front console with storage, Leather steering wheel, 7 total speakers, AM/FM in-dash single CD player stereo, built in subwoofer, purchased with the 4&quot; suspension lift. 4-27-16 Valvoline 10W30 oil and filter change with inspection of motor, suspension track bar replacement. 8-21-15 Hotchkiss Auto Repair installed a rebuilt Jasper Engine (upgrades from stock motor from Jasper Multi-layer steel head gasket and new design cam bearings to improve oil pressure), camshaft position sensor, oil pump drive, and while it was out a clutch kit. (The original motor was found to have metal in the oil so I had it replaced) 3-28-14 2 new tires 33x12.50 Goodyear Wrangler Dura track tires, New rear drive shaft, repair transfer case housing, replaced rear main seal, re-built clutch. (Fastlane automotive) Installed ARB air compressor with hose, Front and Rear TeraFlex Swaybar Quick Disconnects, Smittybilt Rear bumper and spare tire carrier, High lift jack, Sylvania Silver star headlights, Optima Red top battery, Billet Locking fuel door, Poweraid Throttle Body Spacer, K&N Cold air intake, Banks Monster Exhaust System, Prothane Urethane Performance bushing kit. My Jeep came standard with the hard top and doors in addition I will throw in the cargo net restraint system and a removable safari top. Additional service records available.",NA,NA,NA,NA,FALSE,Private Seller,Sahara,2002,Used,Provo,Private,NA,NA
10,Used 2007 Jeep Wrangler Unlimited Sahara,353,/cars-for-sale/vehicledetails.xhtml?listingId=456345886&zip=84604&referrer=%2Fcars-for-sale%2Fsearchresults.xhtml%3Fzip%3D84604%26sellerTypes%3Dp%26minPrice%3D10000%26startYear%3D1981%26numRecords%3D100%26sortBy%3Drelevance%26maxPrice%3D27000%26incremental%3Dall%26firstRecord%3D0%26endYear%3D2019%26makeCodeList%3DJEEP%26searchRadius%3D0&sellerTypes=p&minPrice=10000&startYear=1981&numRecords=100&maxPrice=27000&firstRecord=0&endYear=2019&makeCodeList=JEEP&searchRadius=0&makeCode1=JEEP&modelCode1=WRANGLER,23500,FALSE,Sport Utility,4 wheel drive,6 Cylinder,53400,Automatic,AT-1B33491E,Gasoline,Information Unavailable,1J8GA59117L216946,Keyless EntryLeather SeatsPower LocksPower WindowsPremium WheelsTrailer Hitch,#000000,#000000,"Engine rebuild and exhaust manifold replacement at 53,375 miles. Rebuild with warranty completed by All American 4X4 in Littleton, CO. Custom lift kit, front and rear bumper, running boards, roof rack, light bar, and off road tires. Interior and exterior in great condition except for driver sider rear bumper.",NA,NA,NA,NA,FALSE,Private Seller,Unlimited Sahara,2007,Used,Provo,Private,NA,NA
11,Used 2007 Jeep Wrangler X,355,/cars-for-sale/vehicledetails.xhtml?listingId=482459302&zip=84604&referrer=%2Fcars-for-sale%2Fsearchresults.xhtml%3Fzip%3D84604%26sellerTypes%3Dp%26minPrice%3D10000%26startYear%3D1981%26numRecords%3D100%26sortBy%3Drelevance%26maxPrice%3D27000%26incremental%3Dall%26firstRecord%3D0%26endYear%3D2019%26makeCodeList%3DJEEP%26searchRadius%3D0&sellerTypes=p&minPrice=10000&startYear=1981&numRecords=100&maxPrice=27000&firstRecord=0&endYear=2019&makeCodeList=JEEP&searchRadius=0&makeCode1=JEEP&modelCode1=WRANGLER,11500,FALSE,Sport Utility,4 wheel drive,6-Cylinder,138381,Manual,AT-1CC1BEA6,Gasoline,Information Unavailable,1J4FA24187L151628,Bluetooth Hands-FreeCD PlayerDVD PlayerPortable Audio ConnectionPremium AudioTrailer Hitch,#248B15,#454545,"I m selling my baby because of a baby.  While a trail-rated, six-speed, two-door, soft-top Jeep is awesome for dirt roads, snow, and summer drives with the top down, it is not great for child seats, infants, or wives who find it hard to shift and waive a rattle around.  So, the new kid is in, and my Wrangler is out.I bought this Jeep new in 2007.  I actually ordered it from the factory while I was deployed with the U.S. Army in 2006.  I had dreams of lifting it, slapping on some big, bad tires, and taking it off road.  As you can see from the photos, that never happened.  It s pretty much still stock, and it has rarely felt anything but pavement.  It has an after-market Pioneer stereo (iPhone hookup and Bluetooth) to go with the factory-upgraded Infinity speakers and subwoofer.  Clean CARFAX.I did your comparison shopping for you (but you should still do your own research), and here s what I found: Jeeps like this list around $12,900.  Those Jeeps have better wheels and newer tops.  They typically have higher miles, and they don t have the upgraded speakers.  Wear and tear is similar.  My Jeep has a golf ball size dent in the passenger door, and I ve worn out the steering wheel and floor.  Apparently, I ve put my hand and heel in the same spots everyday for the last ten years.  You can t Jeep Waive from anywhere else, though.  (If you re not going to Jeep Waive, don t call.)  There s a red one in Colorado Springs for $10,500 with 116,000 miles and a hard top.  There might be something wrong with it, but if there isn t, that s a great deal, and you should go buy that one!  If you miss it, though, give me a call.If you re curious, I now have a Volvo.",NA,NA,NA,NA,FALSE,Private Seller,X,2007,Used,Provo,Private,NA,NA
12,Used 2010 Jeep Wrangler Unlimited Rubicon,356,/cars-for-sale/vehicledetails.xhtml?listingId=478196428&zip=84604&referrer=%2Fcars-for-sale%2Fsearchresults.xhtml%3Fzip%3D84604%26sellerTypes%3Dp%26minPrice%3D10000%26startYear%3D1981%26numRecords%3D100%26sortBy%3Drelevance%26maxPrice%3D27000%26incremental%3Dall%26firstRecord%3D0%26endYear%3D2019%26makeCodeList%3DJEEP%26searchRadius%3D0&sellerTypes=p&minPrice=10000&startYear=1981&numRecords=100&maxPrice=27000&firstRecord=0&endYear=2019&makeCodeList=JEEP&searchRadius=0&makeCode1=JEEP&modelCode1=WRANGLER,25999,FALSE,Sport Utility,4 wheel drive - rear,6-Cylinder,49172,Manual,AT-1C80B2CC,Gasoline,Information Unavailable,1J4HA6H16AL109735,CD PlayerCruise ControlDVD PlayerLift KitPortable Audio ConnectionPower LocksPower WindowsPremium AudioPremium WheelsSecurity System,#A31B1B,#000000,"**Reduced Price**I wish I didn't have to sell my Jeep but I need money due to a recent unexpected expense. This Jeep has treated me well for 7+ years and I know you will love it too.This Jeep is great as a daily driver but is also built for off-roading. It has only been used a 3-4 of times off-roading on easy trails and was mostly used as a daily driver. All maintenance was done on schedule and oil changes were performed every 3,000-3,500 miles with Mobile 1 full-synthetic every time. 2nd owner, clean title in hand, non-smoker.Features:- 4.5&quot; Rubicon Express lift-kit- G2 5.13 gears- Front & rear lockers- 37x17x12.5 BF Goodrich All-Terrain tires (lots of tread)- 17&quot; Chrome Moto Metal wheels- 9,500 lb Smittybilt Winch w/ wired controller- Steel grille-guard/bumpers/running boards/tire rack- Off-road/fog lights- Mopar cold-air intake- Superchips programmer- Alpine DVD/iPod receiver w/ 12&quot; Alpine Type R subwoofer- Battery replaced in NovemberCons:- Scratches on interior of trunk tailgate (have touch-up paint but figured it would just get scratched again)- Minor scrapes/scratches on interior (nothing serious)- Some paint flaked off bumpers but was touched up- Scratches on hard-top from falling over while it was off the Jeep in storage (also have touch up paint)This is my daily driver until it is sold so mileage will go up (appx 10 mi / day). Price somewhat negotiable. Wire transfer, local cashier's check or local money order only. If calling, please leave a message and I will return your call.",NA,NA,NA,NA,FALSE,Private Seller,Unlimited Rubicon,2010,Used,Provo,Private,NA,NA
13,Used 1983 Jeep CJ 7,357,/cars-for-sale/vehicledetails.xhtml?listingId=481201068&zip=84604&referrer=%2Fcars-for-sale%2Fsearchresults.xhtml%3Fzip%3D84604%26sellerTypes%3Dp%26minPrice%3D10000%26startYear%3D1981%26numRecords%3D100%26sortBy%3Drelevance%26maxPrice%3D27000%26incremental%3Dall%26firstRecord%3D0%26endYear%3D2019%26makeCodeList%3DJEEP%26searchRadius%3D0&sellerTypes=p&minPrice=10000&startYear=1981&numRecords=100&maxPrice=27000&firstRecord=0&endYear=2019&makeCodeList=JEEP&searchRadius=0&makeCode1=JEEP&modelCode1=JEEPCJ,15999,FALSE,Sport Utility,4 wheel drive - rear,8-Cylinder,55e3,Manual,AT-1CAE8BAC,Gasoline,Information Unavailable,1JCCM87A6DT060320,Leather Seats,#454545,#000000,"Unbelievable completely renovated 1983 Jeep CJ7 for sale!This project took me a full 4 months of work to completely strip down and rebuild. I have literally spared no expense on this jeep and have well over $35,000 invested in it. I built it so that rust will never be an issue with all stainless nuts/bolts/components and a fully rhino lined body. The engine has also been extensively worked on and I have her running like a top. This is the most unique Jeep you are going to find. Lots of cool custom features. I'll let the list below speak for itself. This is the best jeep out there and a bargain at this price. Engine: 327 Small Block with about 50,000 miles on it. I believe I'm getting 300 HP currently.Transmission: Muncie SM465 Fuel Injection: Edelbrock-36679 E Street 2 EFI, Fuel rails, throttle body, 4 barrel square bore mounting flange, Manufactures #36679 ($2100)Electric Fan: Just had a brand new electric fan installed ($700)Wheels/Tires: Toyo R/T Open Country with Rockstar 2 Rims (set of 5) ($3,200). Professionally mounted, balanced, and aligned. These have less than 1,000 miles on them. Timing: Just had it professionally adjusted.Gauges: Push start! All new digital gaugesCoating: Full coat of Rhino liner on the entire body (inside the cab, outside the cab, underside of body). Coating was performed by a professional Paint shop ($2500)Headers: Custom pipes that really scream. They are coated with temperature resistant black paint, she's loud!Winch: Warn XD9000i ($1,000 new - I bought used for $700)Battery: New Odyssey Extreme GRP34 880CCA battery ($250)Nuts/Bolts: I replaced 95% of the nuts and bolts on this vehicle with Stainless Steel nuts/bolts including all the engine nuts/bolts. Out of space - Many more features and upgrades on this jeep!",NA,NA,NA,NA,FALSE,Private Seller,7,1983,Used,Provo,Private,NA,NA
14,Used 2011 Jeep Wrangler Unlimited Sport,358,/cars-for-sale/vehicledetails.xhtml?listingId=480043556&zip=84604&referrer=%2Fcars-for-sale%2Fsearchresults.xhtml%3Fzip%3D84604%26sellerTypes%3Dp%26minPrice%3D10000%26startYear%3D1981%26numRecords%3D100%26sortBy%3Drelevance%26maxPrice%3D27000%26incremental%3Dall%26firstRecord%3D0%26endYear%3D2019%26makeCodeList%3DJEEP%26searchRadius%3D0&sellerTypes=p&minPrice=10000&startYear=1981&numRecords=100&maxPrice=27000&firstRecord=0&endYear=2019&makeCodeList=JEEP&searchRadius=0&makeCode1=JEEP&modelCode1=WRANGLER,19999,FALSE,Sport Utility,4 wheel drive - rear,6-Cylinder,17500,Manual,AT-1C9CE224,Gasoline,Information Unavailable,1J4GA2D18BL571306,CD PlayerCruise ControlMulti-zone Climate ControlPremium AudioPremium WheelsSteering Wheel Controls,#248B15,#454545,"In mint condition with very low-milage, one owner, garaged, manual 6-speed transmission, fog lights, premium alloy wheels, running boards, A/C, cruise control, dual-airbags, side airbags,  and brand new rear window panel.",NA,NA,NA,NA,FALSE,Private Seller,Unlimited Sport,2011,Used,Provo,Private,NA,NA
15,Used 2010 Jeep Wrangler Unlimited Sport,359,/cars-for-sale/vehicledetails.xhtml?listingId=462722851&zip=84604&referrer=%2Fcars-for-sale%2Fsearchresults.xhtml%3Fzip%3D84604%26sellerTypes%3Dp%26minPrice%3D10000%26startYear%3D1981%26numRecords%3D100%26sortBy%3Drelevance%26maxPrice%3D27000%26incremental%3Dall%26firstRecord%3D0%26endYear%3D2019%26makeCodeList%3DJEEP%26searchRadius%3D0&sellerTypes=p&minPrice=10000&startYear=1981&numRecords=100&maxPrice=27000&firstRecord=0&endYear=2019&makeCodeList=JEEP&searchRadius=0&makeCode1=JEEP&modelCode1=WRANGLER,26400,FALSE,Sport Utility,4 wheel drive - rear,6-Cylinder,69e3,Information Unavailable,AT-1B949723,Gasoline,Information Unavailable,1J4BA3H18AL216127,CD PlayerCruise ControlKeyless EntryLift KitPower LocksPower WindowsPremium AudioPremium WheelsSecurity SystemSteering Wheel Controls,#248B15,#F5F5DC,"Supercharged JKU! Less than 9k miles on a complete engine build. Awesome power on trail or highway. ENGINE (less than 9k miles):RIPP supercharger505 forged low-compression pistons, rods, rings, pins, bearings, and crank shaftNitro valvesCoys timing setDiablo TunerAutometer AFR gauge and boost gaugeEXTERIOR:Wild Boar Fastback Top18&quot; KMC XD RockstarsBFG 35X12.50R18 MTsRock Hard Stubby front w/ stingerX2O 10,000lb winchSmittybilt XRC rear bumper w/ tire carrierRock Hard license plate relocatorRock Hard roller fairlead license plate bracketPoison Spider Bombshell diff covers (front and rear)SUSPENSION:Pro Comp 3.5 inch lift kitPro Comp Pro Runner shocksPro Comp steering stabilizerMoog Ball JointsCurrie Antirock Sway bar systemTeraflex track bar. GEARING: G2 Dana 44 5.13Detroit True Trac spider gearsEXTRAS:Alpine 9 speaker upgradeBeige/Green interiorHi-Lift 48&quot; X-TremeNew rotorsARB snatch blockBinder w/ window sticker and all receipts/docsAll work professionally completed.",NA,NA,NA,NA,FALSE,Private Seller,Unlimited Sport,2010,Used,Provo,Private,NA,NA
